{
  "capabilities": {
    "cutter": true,
    "encoder": true,
    "endless_spool": true,
    "espooler": false,
    "gate_sensors": true,
    "led": true,
    "nfc": false,
    "selector": true,
    "servo": true,
    "spoolman": true,
    "sync_feedback": true,
    "toolhead_sensor": true
  },
  "display_name": "ERCF 2.0",
  "hardware": {
    "led": {
      "count": 6,
      "pin": "main:PA0",
      "type": "neopixel"
    },
    "mcu": [
      {
        "name": "mmu_main",
        "serial_by_id": "/dev/serial/by-id/usb-DogMatrix_MMU-main-if00",
        "transport": "usb"
      }
    ],
    "nfc": {
      "bus": "none",
      "type": "none"
    }
  },
  "limits": {
    "bowden_length_mm": 500,
    "encoder_error_mm": 5,
    "max_accel_mm_s2": 1500,
    "max_distance_mm": 1200,
    "max_jerk_mm_s3": 8000,
    "max_load_speed_mm_s": 70,
    "max_unload_speed_mm_s": 80,
    "sensor_timeout_ms": 500,
    "toolhead_distance_mm": 70
  },
  "profile_id": "dog_matrix.ercf.v1",
  "schema_version": 1,
  "topology": {
    "gate_pitch_mm": 22.5,
    "gates": 6,
    "selector_type": "linear",
    "type": "selector",
    "units": 1
  }
}
